{
  "child_id": "a1b2c3d4-e5f6-7890-abcd-ef1234567890",
  "session_id": "sess_20260403_002",
  "generated_at": "2026-04-03T10:22:15Z",
  "skill_nodes": [
    {
      "skill_name": "phonics",
      "skill_display_name": "Phonics & Sounds",
      "mastery_prob": 0.31,
      "mastery_class": "low",
      "previous_mastery": 0.30,
      "confidence": 0.72,
      "trend": "stable",
      "regression_flagged": false,
      "reinforcement_need": "high",
      "prerequisite_skills": ["letter_recognition"],
      "prerequisite_met": true,
      "unlocked": true,
      "evidence_summary": "4/7 tasks correct (57%); used hints 3 times; holding steady. Confidence moderate — needs more data.",
      "cold_start": false,
      "last_updated": "2026-04-03T10:22:15Z",
      "session_id": "sess_20260403_002"
    },
    {
      "skill_name": "letter_recognition",
      "skill_display_name": "Letter Recognition",
      "mastery_prob": 0.48,
      "mastery_class": "developing",
      "previous_mastery": 0.35,
      "confidence": 0.78,
      "trend": "improving",
      "regression_flagged": false,
      "reinforcement_need": "low",
      "prerequisite_skills": [],
      "prerequisite_met": true,
      "unlocked": true,
      "evidence_summary": "6/8 tasks correct (75%); finished with a 4-task streak; trending up.",
      "cold_start": false,
      "last_updated": "2026-04-03T10:22:15Z",
      "session_id": "sess_20260403_002"
    },
    {
      "skill_name": "counting",
      "skill_display_name": "Counting",
      "mastery_prob": 0.62,
      "mastery_class": "developing",
      "previous_mastery": 0.55,
      "confidence": 0.83,
      "trend": "improving",
      "regression_flagged": false,
      "reinforcement_need": "low",
      "prerequisite_skills": [],
      "prerequisite_met": true,
      "unlocked": true,
      "evidence_summary": "7/9 tasks correct (78%); finished with a 3-task streak; trending up.",
      "cold_start": false,
      "last_updated": "2026-04-03T10:22:15Z",
      "session_id": "sess_20260403_002"
    },
    {
      "skill_name": "number_order",
      "skill_display_name": "Number Order",
      "mastery_prob": 0.28,
      "mastery_class": "low",
      "previous_mastery": 0.30,
      "confidence": 0.65,
      "trend": "stable",
      "regression_flagged": false,
      "reinforcement_need": "high",
      "prerequisite_skills": ["counting"],
      "prerequisite_met": true,
      "unlocked": true,
      "evidence_summary": "3/6 tasks correct (50%); used hints 2 times; holding steady.",
      "cold_start": false,
      "last_updated": "2026-04-03T10:22:15Z",
      "session_id": "sess_20260403_002"
    },
    {
      "skill_name": "shape_recognition",
      "skill_display_name": "Shape Recognition",
      "mastery_prob": 0.67,
      "mastery_class": "developing",
      "previous_mastery": 0.55,
      "confidence": 0.81,
      "trend": "improving",
      "regression_flagged": false,
      "reinforcement_need": "low",
      "prerequisite_skills": [],
      "prerequisite_met": true,
      "unlocked": true,
      "evidence_summary": "8/10 tasks correct (80%); finished with a 5-task streak; trending up.",
      "cold_start": false,
      "last_updated": "2026-04-03T10:22:15Z",
      "session_id": "sess_20260403_002"
    },
    {
      "skill_name": "color_sorting",
      "skill_display_name": "Color Sorting",
      "mastery_prob": 0.72,
      "mastery_class": "high",
      "previous_mastery": 0.60,
      "confidence": 0.88,
      "trend": "improving",
      "regression_flagged": false,
      "reinforcement_need": "low",
      "prerequisite_skills": ["shape_recognition"],
      "prerequisite_met": true,
      "unlocked": true,
      "evidence_summary": "9/11 tasks correct (82%); finished with a 6-task streak; trending up.",
      "cold_start": false,
      "last_updated": "2026-04-03T10:22:15Z",
      "session_id": "sess_20260403_002"
    },
    {
      "skill_name": "hand_eye_coordination",
      "skill_display_name": "Hand-Eye Coordination",
      "mastery_prob": 0.45,
      "mastery_class": "developing",
      "previous_mastery": 0.45,
      "confidence": 0.67,
      "trend": "stable",
      "regression_flagged": false,
      "reinforcement_need": "low",
      "prerequisite_skills": [],
      "prerequisite_met": true,
      "unlocked": true,
      "evidence_summary": "5/8 tasks correct (63%); holding steady.",
      "cold_start": false,
      "last_updated": "2026-04-03T10:22:15Z",
      "session_id": "sess_20260403_002"
    },
    {
      "skill_name": "attention_retention",
      "skill_display_name": "Focus & Attention",
      "mastery_prob": 0.38,
      "mastery_class": "low",
      "previous_mastery": 0.35,
      "confidence": 0.62,
      "trend": "stable",
      "regression_flagged": false,
      "reinforcement_need": "high",
      "prerequisite_skills": [],
      "prerequisite_met": true,
      "unlocked": true,
      "evidence_summary": "No activity data yet for this skill in this session.",
      "cold_start": true,
      "last_updated": "2026-04-03T10:22:15Z",
      "session_id": "sess_20260403_002"
    },
    {
      "skill_name": "memory_recall",
      "skill_display_name": "Memory",
      "mastery_prob": 0.30,
      "mastery_class": "low",
      "previous_mastery": 0.30,
      "confidence": 0.40,
      "trend": "stable",
      "regression_flagged": false,
      "reinforcement_need": "high",
      "prerequisite_skills": ["attention_retention"],
      "prerequisite_met": false,
      "unlocked": false,
      "evidence_summary": "No data yet for Memory. Estimate based on age group.",
      "cold_start": true,
      "last_updated": "2026-04-03T10:22:15Z",
      "session_id": "sess_20260403_002"
    },
    {
      "skill_name": "social_response",
      "skill_display_name": "Social Awareness",
      "mastery_prob": 0.50,
      "mastery_class": "developing",
      "previous_mastery": 0.50,
      "confidence": 0.40,
      "trend": "stable",
      "regression_flagged": false,
      "reinforcement_need": "low",
      "prerequisite_skills": [],
      "prerequisite_met": true,
      "unlocked": true,
      "evidence_summary": "No data yet for Social Awareness. Estimate based on age group.",
      "cold_start": true,
      "last_updated": "2026-04-03T10:22:15Z",
      "session_id": "sess_20260403_002"
    },
    {
      "skill_name": "emotional_regulation",
      "skill_display_name": "Emotional Understanding",
      "mastery_prob": 0.38,
      "mastery_class": "low",
      "previous_mastery": 0.38,
      "confidence": 0.40,
      "trend": "stable",
      "regression_flagged": false,
      "reinforcement_need": "high",
      "prerequisite_skills": ["social_response"],
      "prerequisite_met": true,
      "unlocked": true,
      "evidence_summary": "No data yet for Emotional Understanding. Estimate based on age group.",
      "cold_start": true,
      "last_updated": "2026-04-03T10:22:15Z",
      "session_id": "sess_20260403_002"
    }
  ],
  "summary": {
    "skills_mastered": ["color_sorting"],
    "skills_developing": ["letter_recognition", "counting", "shape_recognition", "hand_eye_coordination", "social_response"],
    "skills_need_support": ["phonics", "number_order", "attention_retention", "memory_recall", "emotional_regulation"],
    "skills_regressing": [],
    "skills_unlocked": ["counting", "color_sorting", "emotional_regulation", "hand_eye_coordination",
                        "letter_recognition", "number_order", "phonics", "shape_recognition", "social_response"],
    "overall_progress_pct": 46.3
  }
}
